{
  "schemaVersion": "caatuu-morphology-developer-pilot-v1",
  "catalogId": "caatuu.cs-CZ.morphology-present-person-developer-pilot",
  "version": "1.0.0",
  "targetLocale": "cs-CZ",
  "review": {
    "status": "prototype-not-human-approved",
    "notesEn": "This six-form catalog is a developer contract fixture. Native Czech educator approval and a new non-pilot catalog are required before learner release."
  },
  "families": [
    {
      "id": "cs.morphology.family.cist.present-person-number",
      "revision": 1,
      "lemmaRef": {
        "id": "cs.lexeme.cist",
        "revision": 1
      },
      "review": {
        "status": "prototype-not-human-approved",
        "notesEn": "The six-form present-person family, Czech forms, register limits, and teaching order require native Czech educator review."
      },
      "metadata": {
        "lemmaTarget": "číst",
        "glossEn": "read",
        "exerciseFamilyId": "conjugation-comet.contextual-target-realization",
        "capabilityRef": {
          "id": "capability.contextual-target-realization.visible-form-choice",
          "revision": 1
        },
        "targetSkillRef": {
          "id": "cs.skill.form.cist.present-person-number",
          "revision": 1
        },
        "unitRef": {
          "id": "unit.routine.familiar-actions.01",
          "revision": 1
        },
        "senseRef": {
          "id": "cs.sense.cist.read",
          "revision": 1
        },
        "canonicalSemanticRefs": [
          {
            "id": "function.describe-action",
            "revision": 1
          },
          {
            "id": "frame.action",
            "revision": 1
          },
          {
            "id": "concept.action.read",
            "revision": 1
          }
        ],
        "difficulty": {
          "dimension": "realization-complexity",
          "level": 3,
          "rationaleEn": "The present stem differs from the citation form, so difficulty is recorded as advisory realization complexity rather than as curriculum order or mastery.",
          "advisoryOnly": true
        },
        "register": [
          "neutral"
        ],
        "prerequisiteRefs": [
          {
            "entityType": "sense",
            "id": "cs.sense.cist.read",
            "revision": 1
          }
        ],
        "provenance": {
          "sourceType": "authored",
          "sourceId": "caatuu-morphology-developer-pilot-2026-08-02",
          "sourceRevision": "1",
          "licenseId": "MIT",
          "attributionEn": "Authored as a Caatuu curriculum contract fixture.",
          "transformationEn": "Stable forms and features were entered explicitly; no paradigm was inferred from the Core dictionary cue."
        },
        "review": {
          "status": "prototype-not-human-approved",
          "notesEn": "The six-form prototype metadata is descriptive only and cannot establish release authority."
        }
      }
    }
  ],
  "items": [
    {
      "id": "cs.form.cist.present-indicative.1sg",
      "revision": 2,
      "familyRef": {
        "id": "cs.morphology.family.cist.present-person-number",
        "revision": 1
      },
      "surface": "čtu",
      "acceptedVariants": [],
      "featureKey": "present.indicative.imperfective.1.singular",
      "features": {
        "cs.verb.aspect": "imperfective",
        "cs.verb.form": "finite",
        "cs.verb.mood": "indicative",
        "cs.verb.tense": "present",
        "cs.verb.person": 1,
        "cs.verb.number": "singular",
        "cs.verb.polarity": "affirmative"
      },
      "ambiguity": {
        "mode": "none"
      },
      "review": {
        "status": "prototype-not-human-approved",
        "notesEn": "The form, feature bundle, preferred surface, register, and beginner suitability require native Czech educator review."
      },
      "metadata": {
        "lexemeRef": {
          "id": "cs.lexeme.cist",
          "revision": 1
        },
        "senseRef": {
          "id": "cs.sense.cist.read",
          "revision": 1
        },
        "formRef": {
          "id": "cs.form.cist.present-indicative.1sg",
          "revision": 2
        },
        "unitRef": {
          "id": "unit.routine.familiar-actions.01",
          "revision": 1
        },
        "realizationType": "synthetic",
        "normalization": "NFC",
        "variantRecords": [
          {
            "id": "cs.variant.cist.present-indicative.1sg.standard",
            "revision": 2,
            "surface": "čtu",
            "acceptance": "preferred",
            "register": [
              "neutral"
            ]
          }
        ],
        "ambiguityRationaleEn": "Within this reviewed six-form family, the NFC surface maps to one feature key.",
        "register": [
          "neutral"
        ],
        "prerequisiteRefs": [
          {
            "entityType": "sense",
            "id": "cs.sense.cist.read",
            "revision": 1
          }
        ],
        "difficulty": {
          "dimension": "realization-complexity",
          "level": 3,
          "rationaleEn": "The citation form and present stem differ, so the first-person singular surface must be learned as an authored form.",
          "advisoryOnly": true
        },
        "provenance": {
          "sourceType": "authored",
          "sourceId": "caatuu-morphology-present-person-developer-pilot-2026-08-03",
          "sourceRevision": "1",
          "licenseId": "MIT",
          "attributionEn": "Authored as a Caatuu curriculum contract fixture.",
          "transformationEn": "The surface and feature analysis were entered explicitly; no automatic conjugator supplied release authority."
        },
        "review": {
          "status": "prototype-not-human-approved",
          "notesEn": "Item metadata remains provisional even when deterministic validation succeeds."
        }
      }
    },
    {
      "id": "cs.form.cist.present-indicative.2sg",
      "revision": 3,
      "familyRef": {
        "id": "cs.morphology.family.cist.present-person-number",
        "revision": 1
      },
      "surface": "čteš",
      "acceptedVariants": [],
      "featureKey": "present.indicative.imperfective.2.singular",
      "features": {
        "cs.verb.aspect": "imperfective",
        "cs.verb.form": "finite",
        "cs.verb.mood": "indicative",
        "cs.verb.tense": "present",
        "cs.verb.person": 2,
        "cs.verb.number": "singular",
        "cs.verb.polarity": "affirmative",
        "cs.address.formality": "familiar"
      },
      "ambiguity": {
        "mode": "none"
      },
      "review": {
        "status": "prototype-not-human-approved",
        "notesEn": "The form, feature bundle, preferred surface, register, and beginner suitability require native Czech educator review."
      },
      "metadata": {
        "lexemeRef": {
          "id": "cs.lexeme.cist",
          "revision": 1
        },
        "senseRef": {
          "id": "cs.sense.cist.read",
          "revision": 1
        },
        "formRef": {
          "id": "cs.form.cist.present-indicative.2sg",
          "revision": 3
        },
        "unitRef": {
          "id": "unit.routine.familiar-actions.01",
          "revision": 1
        },
        "realizationType": "synthetic",
        "normalization": "NFC",
        "variantRecords": [
          {
            "id": "cs.variant.cist.present-indicative.2sg.standard",
            "revision": 3,
            "surface": "čteš",
            "acceptance": "preferred",
            "register": [
              "familiar"
            ]
          }
        ],
        "ambiguityRationaleEn": "Within this reviewed six-form family, the NFC surface maps to one feature key.",
        "register": [
          "familiar"
        ],
        "prerequisiteRefs": [
          {
            "entityType": "sense",
            "id": "cs.sense.cist.read",
            "revision": 1
          }
        ],
        "difficulty": {
          "dimension": "realization-complexity",
          "level": 3,
          "rationaleEn": "The present stem differs from the citation form and carries an overt second-person singular ending.",
          "advisoryOnly": true
        },
        "provenance": {
          "sourceType": "authored",
          "sourceId": "caatuu-morphology-present-person-developer-pilot-2026-08-03",
          "sourceRevision": "1",
          "licenseId": "MIT",
          "attributionEn": "Authored as a Caatuu curriculum contract fixture.",
          "transformationEn": "The surface and feature analysis were entered explicitly; no automatic conjugator supplied release authority."
        },
        "review": {
          "status": "prototype-not-human-approved",
          "notesEn": "Item metadata remains provisional even when deterministic validation succeeds."
        }
      }
    },
    {
      "id": "cs.form.cist.present-indicative.3sg",
      "revision": 2,
      "familyRef": {
        "id": "cs.morphology.family.cist.present-person-number",
        "revision": 1
      },
      "surface": "čte",
      "acceptedVariants": [],
      "featureKey": "present.indicative.imperfective.3.singular",
      "features": {
        "cs.verb.aspect": "imperfective",
        "cs.verb.form": "finite",
        "cs.verb.mood": "indicative",
        "cs.verb.tense": "present",
        "cs.verb.person": 3,
        "cs.verb.number": "singular",
        "cs.verb.polarity": "affirmative"
      },
      "ambiguity": {
        "mode": "cue-resolved",
        "resolutionKey": "named-third-person"
      },
      "review": {
        "status": "prototype-not-human-approved",
        "notesEn": "The form, feature bundle, preferred surface, register, and beginner suitability require native Czech educator review."
      },
      "metadata": {
        "lexemeRef": {
          "id": "cs.lexeme.cist",
          "revision": 1
        },
        "senseRef": {
          "id": "cs.sense.cist.read",
          "revision": 1
        },
        "formRef": {